id,label,year,list,link,countries,primary_concepts,secondary_concepts
element_306,Centre pour la culture traditionnelle – musée-école du projet pédagogique de Pusol,2009,GSP,https://ich.unesco.org/fr/BSP/centre-pour-la-culture-traditionnelle-muse-cole-du-projet-pdagogique-de-pusol-00306,Espagne,Muséographie; Projet d'éducation; Recueil de données,"Arts du spectacle; Communauté; Connaissances et pratiques concernant la nature et l’univers; Connaissances traditionnelles; Enseignant; Musée scolaire; Participation de l'étudiant; Pratiques sociales, rituels et événements festifs; Recherche sur le terrain; Savoir-faire liés à l’artisanat traditionnel; Traditions et expressions orales; Vie quotidienne; Zone rurale; Éducation non formelle"
element_245,La dentellerie en Croatie,2009,RL,https://ich.unesco.org/fr/RL/la-dentellerie-en-croatie-00245,Croatie,"Arts textiles; Dentelle; Savoir-faire liés à l’artisanat traditionnel; Zones marines, côtières et insulaires",Aiguille; Artisan; Artisanat; Arts décoratifs; Bobine; Chapeaux; Clergé; Costumes; Formation à l'artisanat; Géométrie; Ile; Lin; Motif; Praticiens âgés; Ressources végétales; Tissage; Vie quotidienne; Zone urbaine
element_250,La tapisserie d’Aubusson,2009,RL,https://ich.unesco.org/fr/RL/la-tapisserie-daubusson-00250,France,Arts textiles; Savoir-faire liés à l’artisanat traditionnel; Tapisserie; Tissage; Zone urbaine,Antiquités; Artisan; Arts graphiques; Cours d'eau; Laine; Meuble; Musée; Or; Peinture; Restauration; Soie; Technique de conservation; Teintures naturelles; Terres humides intérieures
element_251,La tradition du tracé dans la charpente française,2009,RL,https://ich.unesco.org/fr/RL/la-tradition-du-trac-dans-la-charpente-franaise-00251,France,Architecture; Charpenterie; Conception de bâtiment; Savoir-faire liés à l’artisanat traditionnel,Apprentissage (métiers); Artisan; Bois; Construction de logements; Dessin; Guilde; Géométrie; Rite d'initiation; Société secrète; Tenon et mortaise; Transfert de savoir-faire; Écosystème non-spécifique
element_253,L’art des Ashiqs d’Azerbaïdjan,2009,RL,https://ich.unesco.org/fr/RL/lart-des-ashiqs-dazerbadjan-00253,Azerbaïdjan,Danse; Musique instrumentale; Musique vocale; Traditions et expressions orales,Affectivité; Arts du spectacle; Barde; Bois; Concert; Exode rural; Fabrication d'instruments; Histoire orale; Instruments à cordes pincées; Mariage; Narration d'histoires; Nomade; Poésie; Savoir-faire liés à l’artisanat traditionnel; Société pluri-ethnique; Écosystème non-spécifique
element_255,La dentelle de Lefkara ou Lefkaritika,2009,RL,https://ich.unesco.org/fr/RL/la-dentelle-de-lefkara-ou-lefkaritika-00255,Chypre,Arts textiles; Dentelle; Montagne; Savoir-faire liés à l’artisanat traditionnel,"Agro-écosystèmes; Aiguille; Artisan; Broderie; Commerce; Coton; Développement économique et social; Famille; Géométrie; Ile; Lin; Motif; Participation de la femme; Pratiques sociales, rituels et événements festifs; Ressources financières insuffisantes; Tourisme; Zones marines, côtières et insulaires; Éducation non formelle"
element_258,Le Tango,2009,RL,https://ich.unesco.org/fr/RL/le-tango-00258,"Argentine, Uruguay",Arts du spectacle; Danse; Musique instrumentale; Musique vocale,"Affectivité; Artiste; Chorégraphie; Classe ouvrière; Communication interculturelle; Compositeur; Esclavage; Immigrant; Orchestre; Poésie; Pratiques sociales, rituels et événements festifs; Savoir-faire liés à l’artisanat traditionnel; Traditions et expressions orales; Zone urbaine"
element_259,Les processions de la Semaine sainte à Popayán,2009,RL,https://ich.unesco.org/fr/RL/les-processions-de-la-semaine-sainte-popayn-00259,Colombie,"Pratique religieuse; Pratiques sociales, rituels et événements festifs; Procession",Artisanat; Catholicisme; Char; Choeur; Clergé; Costumes; Effigies; Encens; Fanfare; Forces armées; Reconstruction de bâtiments; Savoir-faire liés à l’artisanat traditionnel; Sculpture; Sculpture sur bois; Société pluri-ethnique; Zone urbaine; Église (édifice)
element_265,Le Gagaku,2009,RL,https://ich.unesco.org/fr/RL/le-gagaku-00265,Japon,Arts du spectacle; Musique instrumentale; Musique vocale; Théâtre,Apprentissage (métiers); Aristocratie; Arts du spectacle; Bois (instruments); Chorégraphie; Costumes; Danse; Famille; Idiophones; Instruments de percussion; Instruments à cordes pincées; Politique; Poésie; Zone urbaine
element_266,"L’Ojiya-chijimi, Echigo-jofu : techniques de fabrication du tissu de ramie dans la région d’Uonuma, de la préfecture de Niigata",2009,RL,https://ich.unesco.org/fr/RL/lojiya-chijimi-echigo-jofu-techniques-de-fabrication-du-tissu-de-ramie-dans-la-rgion-duonuma-de-la-prfecture-de-niigata-00266,Japon,Arts textiles; Compétences techniques; Savoir-faire liés à l’artisanat traditionnel; Tissage,Agro-écosystèmes; Artisan; Artisanat; Costumes; Fibre; Fleur; Géométrie; Motif; Neige; Personne âgée; Ressources végétales; Teintures naturelles; Textile; Vêtement
element_271,L’Oku-noto no Aenokoto,2009,RL,https://ich.unesco.org/fr/RL/loku-noto-no-aenokoto-00271,Japon,"Pratiques sociales, rituels et événements festifs; Rituel agraire; Rituel saisonnier; Rituels",Agriculteur; Agro-écosystèmes; Animisme; Boissons fermentées; Costumes; Croyance religieuse; Hospitalité; Offrande; Préparation des aliments; Rituel de prospérité; Riz; Récolte; Shintoïsme
element_272,Le Kagura d’Hayachine,2009,RL,https://ich.unesco.org/fr/RL/le-kagura-dhayachine-00272,Japon,Arts du spectacle; Danse; Masque; Théâtre,Armes blanches; Arts du spectacle; Bois (instruments); Chapeaux; Chorégraphie; Clergé; Costumes; Créatures légendaires; Festival; Idiophones; Instruments de percussion; Montagne; Musique vocale; Mythologie; Pratique religieuse; Shintoïsme; Temple
element_273,L’Akiu no Taue Odori,2009,RL,https://ich.unesco.org/fr/RL/lakiu-no-taue-odori-00273,Japon,Agro-écosystèmes; Arts du spectacle; Danse rituelle; Rituel agraire,Agriculteur; Art populaire; Automne; Changements socioculturels abruptes; Chants de travail; Chorégraphie; Costumes; Festival; Fleur; Instrument de musique; Musique instrumentale; Musique vocale; Printemps; Riz; Shintoïsme; Théâtralisation; Zone urbaine
element_275,Le Dainichido Bugaku,2009,RL,https://ich.unesco.org/fr/RL/le-dainichido-bugaku-00275,Japon,Agro-écosystèmes; Arts du spectacle; Danse rituelle; Rituel saisonnier,Agriculteur; Armes blanches; Artisan; Chapeaux; Cheval; Chorégraphie; Costumes; Créatures légendaires; Famille; Instrument de musique; Masque; Montagne; Musique instrumentale; Nouvel an; Oiseau; Or; Pratique religieuse; Rituels; Shintoïsme; Temple; Tradition orale
element_276,Le Daimokutate,2009,RL,https://ich.unesco.org/fr/RL/le-daimokutate-00276,Japon,Drame; Narration d'histoires; Rite d'initiation; Zone urbaine,Arme; Armes blanches; Arts du spectacle; Clan; Costumes; Forces armées; Guerre; Montagne; Musique vocale; Poésie épique; Reconstitution historique; Temple; Tir à l'arc
element_278,La danse traditionnelle Ainu,2009,RL,https://ich.unesco.org/fr/RL/la-danse-traditionnelle-ainu-00278,Japon,Arts du spectacle; Croyance religieuse; Danse rituelle,"Animal sauvage; Animisme; Armes blanches; Arts du spectacle; Arts textiles; Chamanisme; Chorégraphie; Costumes; Festival; Musique vocale; Plante; Vie quotidienne; Zones marines, côtières et insulaires"
element_279,Le Radif de la musique iranienne,2009,RL,https://ich.unesco.org/fr/RL/le-radif-de-la-musique-iranienne-00279,Iran (République islamique d’),Arts du spectacle; Musique instrumentale; Musique vocale; Notation musicale,"Apprentissage (métiers); Bois (instruments); Compositeur; Connaissances et pratiques concernant la nature et l’univers; Esthétique; Improvisation; Instruments à cordes frottées; Instruments à cordes pincées; Islam; Musicologie; Mémorisation; Philosophie; Pratiques sociales, rituels et événements festifs; Savoir-faire liés à l’artisanat traditionnel; Tradition orale; Traditions et expressions orales; Écosystème non-spécifique; Éducation musicale"
element_281,"Le Ramman, festival religieux et théâtre rituel du Garhwal, dans l’Himalaya, en Inde",2009,RL,https://ich.unesco.org/fr/RL/le-ramman-festival-religieux-et-thtre-rituel-du-garhwal-dans-lhimalaya-en-inde-00281,Inde,Arts du spectacle; Festival; Hindouisme; Montagne; Théâtre,"Activité religieuse; Agriculteur; Agro-écosystèmes; Animal sauvage; Armes blanches; Bétail; Caste; Costumes; Danse rituelle; Instrument de musique; Littérature folklorique; Masque; Musique vocale; Offrande; Poésie épique; Pratiques sociales, rituels et événements festifs; Rituels; Temple; Tradition orale; Transe"
element_288,Le Katta Ashula,2009,RL,https://ich.unesco.org/fr/RL/le-katta-ashula-00288,Ouzbékistan,Arts du spectacle; Montagne; Musique instrumentale; Musique vocale; Représentation théâtrale,"Affectivité; Agro-écosystèmes; Apprentissage (métiers); Arts du spectacle; Connaissances et pratiques concernant la nature et l’univers; Cosmologie; Costumes; Festival; Improvisation; Philosophie; Poésie; Pratiques sociales, rituels et événements festifs; Rituels; Société pluri-ethnique; Théologie; Traditions et expressions orales"
element_290,"La Charte du Mandén, proclamée à Kouroukan Fouga",2009,RL,https://ich.unesco.org/fr/RL/la-charte-du-mandn-proclame-kouroukan-fouga-00290,Mali,"Consolidation de la paix; Herbage, savanne; Instrument international; Rituels; Traditions et expressions orales",Agro-écosystèmes; Clan; Constitution; Droit à l'éducation; Esclavage; Guerre; Liberté de parole; Libre-échange; Société pluri-ethnique; Tradition orale
element_289,"Le Sanké mon, rite de pêche collective dans le Sanké",2009,USL,https://ich.unesco.org/fr/USL/le-sank-mon-rite-de-pche-collective-dans-le-sank-00289,Mali,"Pratiques sociales, rituels et événements festifs; Pêche; Rituels; Terres humides intérieures",Agro-écosystèmes; Animisme; Artisanat; Changement climatique; Chorégraphie; Compétences techniques; Connaissances et pratiques concernant la nature et l’univers; Costumes; Danse; Diminution de la participation; Développement urbain; Festival; Instruments de percussion; Lac; Masque; Offrande; Perte de signification; Pluie; Puits; Ressources en eau; Saison des pluies; Satire; Site sacré; Sécheresse; Traditions et expressions orales; Zone aride; Écosystème dégradé
element_302,"Les techniques textiles traditionnelles des Li : filage, teinture, tissage et broderie",2009,USL,https://ich.unesco.org/fr/USL/les-techniques-textiles-traditionnelles-des-li-filage-teinture-tissage-et-broderie-00302,Chine,"Arts textiles; Broderie; Savoir-faire liés à l’artisanat traditionnel; Tissage; Zones marines, côtières et insulaires",Artisan; Brocart; Changements socioculturels abruptes; Compétences techniques; Costumes; Coton; Croyance religieuse; Diminution de l'intérêt de la jeunesse; Fibre; Filage; Ile; Légende; Mariage; Montagne; Motif; Médias sociaux; Personne âgée; Peu de praticiens; Praticiens âgés; Pratique réduite; Production industrielle; Pénurie de matériaux; Ressources végétales; Répertoire restreint; Tabou; Teintures naturelles; Tradition orale; Transmission interromptue; Éducation standardisée; Élevage invasif
element_303,La conception et les pratiques traditionnelles de construction des ponts chinois de bois en arc,2009,USL,https://ich.unesco.org/fr/USL/la-conception-et-les-pratiques-traditionnelles-de-construction-des-ponts-chinois-de-bois-en-arc-00303,Chine,Agro-écosystèmes; Conception de bâtiment; Pont; Travail du bois,Apprentissage (métiers); Arrivée de nouvelles technologies; Artisan; Bois; Clan; Compétences techniques; Cours d'eau; Développement urbain; Espace culturel; Forêt; Offrande; Outils traditionnels; Perte de signification; Peu de praticiens; Praticiens âgés; Pratique réduite; Pénurie de matériaux; Rémunération insuffisante; Savoir-faire liés à l’artisanat traditionnel; Temple; Tenon et mortaise; Terres humides intérieures; Tradition orale; Transmission réduite
element_304,Le Meshrep,2010,USL,https://ich.unesco.org/fr/USL/le-meshrep-00304,Chine,"Agro-écosystèmes; Danse; Manifestation culturelle; Musique vocale; Pratiques sociales, rituels et événements festifs; Théâtre",Acrobatie; Art populaire; Arts du spectacle; Arts du spectacle; Changements socioculturels abruptes; Costumes; Diminution de l'intérêt de la jeunesse; Drame; Exode rural; Humour (littéraire); Littérature folklorique; Montagne; Musique instrumentale; Médiation; Perte de signification; Praticiens âgés; Pratique réduite; Rituel de fertilité; Répertoire restreint; Théâtralisation; Traditions et expressions orales; Transformation économique rapide; Valeur morale; Zone aride; Éducation culturelle
element_305,Le festival du Nouvel An des Qiang ,2009,USL,https://ich.unesco.org/fr/USL/le-festival-du-nouvel-an-des-qiang-00305,Chine,"Festival; Montagne; Pratiques sociales, rituels et événements festifs; Rituel de prospérité",Agro-écosystèmes; Animisme; Boissons fermentées; Bétail; Calendrier; Catastrophe naturelle; Costumes; Danse; Diminution de l'intérêt de la jeunesse; Diminution de la participation; Exode rural; Famille; Habitat dégradé; Histoire orale; Idiophones; Instruments de percussion; Interaction sociale; Musique vocale; Nouvel an; Offrande; Perte d'espaces culturels; Pratique réduite; Pénurie de matériaux; Sensibilisation à l'environnement; Séisme; Touristification; Transe; Transformation économique rapide; Vénération des morts
element_308,Le rite des Tsars de Kalyady (Tsars de Noël),2009,USL,https://ich.unesco.org/fr/USL/le-rite-des-tsars-de-kalyady-tsars-de-nol-00308,Bélarus,Procession; Représentation théâtrale; Rituel saisonnier,"Agro-écosystèmes; Aliment; Arts du spectacle; Arts décoratifs; Calendrier; Costumes; Danse; Diminution de l'intérêt de la jeunesse; Diminution de la participation; Hiver; Humour (littéraire); Improvisation; Instruments de percussion; Instruments à vents; Manque de respect; Médias de communication de masse; Nouvel an; Pratique religieuse; Pratiques sociales, rituels et événements festifs; Savoir-faire liés à l’artisanat traditionnel; Traditions et expressions orales; Transformation économique rapide"
element_309,Le chant Ca trù,2009,USL,https://ich.unesco.org/fr/USL/le-chant-ca-tr-00309,Viet Nam,Musique vocale; Poésie; Représentation théâtrale,Agro-écosystèmes; Arts du spectacle; Bambou; Concours; Conflits; Danse; Divertissement; Famille; Formation laborieuse; Guilde; Idiophones; Instruments de percussion; Instruments à cordes pincées; Musique instrumentale; Médias de communication de masse; Perte d'espaces culturels; Post-conflit; Praticiens âgés; Pratique religieuse; Pratique réduite; Rémunération insuffisante; Tradition orale; Transformation économique rapide; Éducation non formelle
element_310,"Le Tuuli mongol, épopée mongole",2009,USL,https://ich.unesco.org/fr/USL/le-tuuli-mongol-pope-mongole-00310,Mongolie,Musique vocale; Poésie épique; Traditions et expressions orales,"Arts du spectacle; Barde; Changements socioculturels abruptes; Chant diphonique; Cheval; Compétences techniques; Compétition sportive; Croyance religieuse; Diminution de l'intérêt de la jeunesse; Diminution de la participation; Exode rural; Famille; Festival; Formation laborieuse; Herbage, savanne; Histoire orale; Improvisation; Instruments à cordes frottées; Instruments à cordes pincées; Mariage; Mythologie; Mémorisation; Nomade; Nouveaux passe-temps; Pastoralisme; Perte de la langue ancestrale; Perte de signification; Peu de praticiens; Pratiques sociales, rituels et événements festifs; Répertoire restreint; Savoir-faire liés à l’artisanat traditionnel; Tradition orale; Transmission interromptue; Valeur sociale"
element_311,"Le Biyelgee mongol, danse populaire traditionnelle mongole",2009,USL,https://ich.unesco.org/fr/USL/le-biyelgee-mongol-danse-populaire-traditionnelle-mongole-00311,Mongolie,Danse; Musique instrumentale,"Affectivité; Apprentissage (métiers); Art populaire; Artisanat; Arts du spectacle; Broderie; Changements socioculturels abruptes; Chant diphonique; Chorégraphie; Costumes; Diminution de l'intérêt de la jeunesse; Exode rural; Famille; Herbage, savanne; Instruments à cordes frottées; Joaillerie; Mariage; Motif; Musique vocale; Nomade; Nouveaux passe-temps; Pastoralisme; Politiques répressives; Praticiens âgés; Pratique réduite; Pratiques sociales, rituels et événements festifs; Répertoire restreint; Savoir-faire liés à l’artisanat traditionnel; Société pluri-ethnique; Transformation économique rapide; Transmission interromptue"
element_312,La musique traditionnelle pour flûte tsuur,2009,USL,https://ich.unesco.org/fr/USL/la-musique-traditionnelle-pour-flte-tsuur-00312,Mongolie,Bois (instruments); Musique instrumentale; Musique vocale,"Affectivité; Apprentissage (métiers); Arts du spectacle; Bois; Chamanisme; Chant diphonique; Chasse; Diminution de l'intérêt de la jeunesse; Eau; Exode rural; Fabrication d'instruments; Festival; Formation laborieuse; Habitat dégradé; Herbage, savanne; Mariage; Nomade; Nouveaux passe-temps; Pastoralisme; Peu de praticiens; Politiques répressives; Praticiens âgés; Pratiques sociales, rituels et événements festifs; Répertoire restreint; Sensibilisation à l'environnement; Tradition orale; Transformation économique rapide"
element_313,Les traditions et pratiques associées aux Kayas dans les forêts sacrées des Mijikenda,2009,USL,https://ich.unesco.org/fr/USL/les-traditions-et-pratiques-associes-aux-kayas-dans-les-forts-sacres-des-mijikenda-00313,Kenya,Espace culturel; Forêt; Site sacré,"Animisme; Arts du spectacle; Changements socioculturels abruptes; Connaissance spirituelle; Connaissances et pratiques concernant la nature et l’univers; Conservation de l'environnement; Danse; Diversité biologique; Exode rural; Funérailles; Gouvernance; Habitat dégradé; Herbage, savanne; Histoire orale; Inclusion sociale; Intolérance; Magie; Manque de respect; Mariage; Musique instrumentale; Médecine traditionnelle; Plante médicinale; Praticiens âgés; Pratiques sociales, rituels et événements festifs; Ressources financières insuffisantes; Rite d'initiation; Rituels; Savoir-faire liés à l’artisanat traditionnel; Société pluri-ethnique; Tradition orale; Traditions et expressions orales; Transformation économique rapide; Vénération des morts; Éducation standardisée"
element_314,L’espace culturel des Suiti,2009,USL,https://ich.unesco.org/fr/USL/lespace-culturel-des-suiti-00314,Lettonie,"Espace culturel; Groupe religieux; Pratiques sociales, rituels et événements festifs; Zones marines, côtières et insulaires",Afflux de population; Agro-écosystèmes; Arts du spectacle; Catholicisme; Chant polyphonique; Connaissances et pratiques concernant la nature et l’univers; Costumes; Exode rural; Habitude alimentaire; Humour (littéraire); Improvisation; Intolérance; Langues locales; Manque de respect; Mariage; Musique instrumentale; Musique vocale; Médias de communication de masse; Perte de connaissances; Perte de la langue ancestrale; Praticiens âgés; Pratique religieuse; Pratique réduite; Savoir-faire liés à l’artisanat traditionnel; Tissage; Traditions et expressions orales; Transformation économique rapide; Éducation familiale
element_315,Le Cantu in paghjella profane et liturgique de Corse de tradition orale,2009,USL,https://ich.unesco.org/fr/USL/le-cantu-in-paghjella-profane-et-liturgique-de-corse-de-tradition-orale-00315,France,Chant polyphonique; Montagne; Musique vocale; Traditions et expressions orales,"Agro-écosystèmes; Art religieux; Artiste interprète; Catholicisme; Choeur; Diminution de la participation; Espace urbain; Festival; Foire; Ile; Improvisation; Pastoralisme; Peu de praticiens; Praticiens âgés; Pratique laïque; Pratique religieuse; Pratiques sociales, rituels et événements festifs; Procession; Répertoire restreint; Touristification; Tradition orale; Transmission réduite; Zones marines, côtières et insulaires; Éducation non formelle"
element_320,Le chant Ojkanje,2010,USL,https://ich.unesco.org/fr/USL/le-chant-ojkanje-00320,Croatie,Chant diphonique; Chant polyphonique; Musique vocale,"Affectivité; Agro-écosystèmes; Arts du spectacle; Conflits; Danse; Duo; Exode rural; Matériel audiovisuel; Perte d'espaces culturels; Peu de praticiens; Politique; Post-conflit; Pratiques sociales, rituels et événements festifs; Tradition orale; Traditions et expressions orales; Transfert de savoir-faire; Transformation économique rapide; Transmission réduite"
element_321,La technique des cloisons étanches des jonques chinoises,2010,USL,https://ich.unesco.org/fr/USL/la-technique-des-cloisons-tanches-des-jonques-chinoises-00321,Chine,Compétences techniques; Construction navale,"Apprentissage (métiers); Arbre; Arrivée de nouvelles technologies; Artisan; Bois; Charpenterie; Dessin industriel; Diminution de l'intérêt de la jeunesse; Eau; Famille; Huile végétale; Matière première; Navigation; Navigation à voile; Outils traditionnels; Perte de signification; Peu de praticiens; Praticiens âgés; Pratique religieuse; Production industrielle; Pénurie de matériaux; Pêche en mer; Rémunération insuffisante; Savoir-faire liés à l’artisanat traditionnel; Sécurité des transports; Transfert de savoir-faire; Travail du bois; Zones marines, côtières et insulaires"
element_322,L’imprimerie chinoise à caractères mobiles en bois,2010,USL,https://ich.unesco.org/fr/USL/limprimerie-chinoise-caractres-mobiles-en-bois-00322,Chine,Composition; Compétences techniques; Gravure; Méthode d'impression; Savoir-faire liés à l’artisanat traditionnel,Apprentissage (métiers); Arrivée de nouvelles technologies; Artisan; Bois; Bouddhisme; Calligraphie; Changements socioculturels abruptes; Diminution de l'intérêt de la jeunesse; Division du travail basée sur le sexe; Encre; Famille; Formation laborieuse; Généalogie; Mémorisation; Papier; Perte de signification; Peu de praticiens; Poésie; Praticiens âgés; Reliure; Rémunération insuffisante; Sculpture sur bois; Tradition orale; Transmission interromptue; Écosystème non-spécifique
element_337,La danse Chhau,2010,RL,https://ich.unesco.org/fr/RL/la-danse-chhau-00337,Inde,Acrobatie; Arts du spectacle; Danse; Hindouisme; Oeuvre littéraire représentative,"Agro-écosystèmes; Animal; Apprentissage (métiers); Armes blanches; Arts martiaux; Bois (instruments); Chorégraphie; Costumes; Festival; Instruments de percussion; Maquillage; Masque; Oiseau; Poésie épique; Pratique religieuse; Pratiques sociales, rituels et événements festifs; Printemps; Rituel saisonnier; Savoir-faire liés à l’artisanat traditionnel; Travestissement"
element_340,Les chants et danses populaires Kalbelia du Rajasthan,2010,RL,https://ich.unesco.org/fr/RL/les-chants-et-danses-populaires-kalbelia-du-rajasthan-00340,Inde,Agro-écosystèmes; Arts du spectacle; Danse; Musique instrumentale; Musique vocale,"Acrobatie; Broderie; Connaissances et pratiques concernant la nature et l’univers; Costumes; Festival; Humour (littéraire); Improvisation; Instrument de musique; Joaillerie; Maquillage; Mythologie; Nomade; Poésie; Pratiques sociales, rituels et événements festifs; Respiration circulaire; Savoir-faire liés à l’artisanat traditionnel; Serpent; Tatouage; Tradition orale; Traditions et expressions orales; Zone aride"
element_345,"Le Mudiyettu, théâtre rituel et drame dansé du Kerala",2010,RL,https://ich.unesco.org/fr/RL/le-mudiyettu-thtre-rituel-et-drame-dans-du-kerala-00345,Inde,Agro-écosystèmes; Arts du spectacle; Danse; Pratique religieuse; Théâtre,"Armes blanches; Caste; Connaissances et pratiques concernant la nature et l’univers; Costumes; Cours d'eau; Dessin; Feu; Hindouisme; Maquillage; Musique instrumentale; Musique vocale; Mythologie; Orchestre; Poésie; Pratiques sociales, rituels et événements festifs; Rituel de prospérité; Rituel de purification; Savoir-faire liés à l’artisanat traditionnel; Temple; Terres humides intérieures; Traditions et expressions orales; Travestissement"
element_356,L’art du pain d’épices en Croatie du Nord,2010,RL,https://ich.unesco.org/fr/RL/lart-du-pain-dpices-en-croatie-du-nord-00356,Croatie,Artisanat; Arts décoratifs; Savoir-faire liés à l’artisanat traditionnel,Agro-écosystèmes; Artisan; Céréale; Esthétique; Famille; Foire; Hiver; Manifestation culturelle; Mariage; Motif; Peinture; Pratique religieuse; Préparation des aliments; Ressources végétales; Sucre; Église (édifice)
element_357,"Le Sinjska Alka, un tournoi de chevalerie à Sinj",2010,RL,https://ich.unesco.org/fr/RL/le-sinjska-alka-un-tournoi-de-chevalerie-sinj-00357,Croatie,"Compétition sportive; Festival; Jeux équestres; Pratiques sociales, rituels et événements festifs; Zone urbaine",Armes blanches; Artisanat; Arts du spectacle; Catholicisme; Cheval; Chevaliers; Costumes; Famille; Fanfare; Forces armées; Montagne; Pratique religieuse; Procession; Reconstitution historique; Savoir-faire liés à l’artisanat traditionnel; Traditions et expressions orales; Éthique
element_358,La pratique du chant et de la musique bećarac de Croatie orientale,2011,RL,https://ich.unesco.org/fr/RL/la-pratique-du-chant-et-de-la-musique-bearac-de-croatie-orientale-00358,Croatie,Improvisation; Musique instrumentale; Musique vocale,"Affectivité; Agro-écosystèmes; Arts du spectacle; Choeur; Costumes; Culture de masse; Humour (littéraire); Instruments à cordes; Instruments à vents; Mariage; Pratiques sociales, rituels et événements festifs; Satire; Traditions et expressions orales; Valeur sociale"
