id,label,year,list,link,countries,primary_concepts,secondary_concepts
element_1098,"L’écomusée de la Batana, projet communautaire de sauvegarde de la culture vivante de Rovinj/Rovign",2016,GSP,https://ich.unesco.org/fr/BSP/lcomuse-de-la-batana-projet-communautaire-de-sauvegarde-de-la-culture-vivante-de-rovinj-rovign-01098,Croatie,Compétences techniques; Savoir-faire liés à l’artisanat traditionnel; Écomusée,"Artisan; Arts du spectacle; Bois; Choeur; Connaissances et pratiques concernant la nature et l’univers; Famille; Festival; Musique vocale; Navire; Organisation culturelle; Pratiques de sauvegarde; Pratiques sociales, rituels et événements festifs; Prix et distinction; Publication scientifique; Pêche en mer; Tourisme; Traditions et expressions orales; Travail du bois"
element_1099,"Les musiques de marimba, les chants et les danses traditionnels de la région du Pacifique Sud colombien et de la province d'Esmeraldas d'Équateur",2015,RL,https://ich.unesco.org/fr/RL/les-musiques-de-marimba-les-chants-et-les-danses-traditionnels-de-la-rgion-du-pacifique-sud-colombien-et-de-la-province-d-esmeraldas-d-quateur-01099,"Colombie, Équateur",Danse; Idiophones; Musique instrumentale,"Arts du spectacle; Bambou; Bois; Connaissances et pratiques concernant la nature et l’univers; Fabrication d'instruments; Funérailles; Habitude alimentaire; Histoire orale; Musique vocale; Navire; Poésie; Pratique religieuse; Pratiques sociales, rituels et événements festifs; Savoir-faire liés à l’artisanat traditionnel; Traditions et expressions orales; Zones marines, côtières et insulaires"
element_1103,Le savoir-faire artisanal tiniote du marbre,2015,RL,https://ich.unesco.org/fr/RL/le-savoir-faire-artisanal-tiniote-du-marbre-01103,Grèce,Artisan; Marbre; Savoir-faire liés à l’artisanat traditionnel; Sculpture,"Apprentissage (métiers); Arts décoratifs; Connaissances et pratiques concernant la nature et l’univers; Croyance religieuse; Dessin; Ile; Motif; Outils traditionnels; Pratiques sociales, rituels et événements festifs; Restauration; Travail du métal; Zones marines, côtières et insulaires"
element_1104,"Le glasoechko, chant d'hommes à deux voix dans le bas Polog",2015,USL,https://ich.unesco.org/fr/USL/le-glasoechko-chant-d-hommes-deux-voix-dans-le-bas-polog-01104,Macédoine du Nord,Chant polyphonique; Duo; Montagne; Musique vocale,Agriculture; Agro-écosystèmes; Apprentissage (métiers); Arts du spectacle; Bois (instruments); Changements socioculturels abruptes; Chants de travail; Conflits; Costumes; Exode rural; Instruments à vents; Mariage; Perte d'espaces culturels; Post-conflit; Praticiens âgés; Rassemblement; Répertoire restreint; Société pluri-ethnique; Talent; Tradition orale; Transmission interromptue
element_1106,L'équitation classique et la Haute École de l'École d'équitation espagnole de Vienne,2015,RL,https://ich.unesco.org/fr/RL/l-quitation-classique-et-la-haute-cole-de-l-cole-d-quitation-espagnole-de-vienne-01106,Autriche,Arts du spectacle; Cheval; Zootechnie; Équitation,"Apprentissage (métiers); Artisan; Centre de formation; Chapeaux; Compétences techniques; Connaissances et pratiques concernant la nature et l’univers; Costumes; Cuir; Génétique animale; Médecine vétérinaire; Pratiques sociales, rituels et événements festifs; Savoir-faire liés à l’artisanat traditionnel; Traditions et expressions orales; Travail du métal; Zone urbaine"
element_1108,"La Charrería, tradition équestre au Mexique",2016,RL,https://ich.unesco.org/fr/RL/la-charrera-tradition-questre-au-mexique-01108,Mexique,"Cheval; Compétition sportive; Pratiques sociales, rituels et événements festifs",Agro-écosystèmes; Artisan; Artisanat; Arts du spectacle; Bétail; Costumes; Danse; Famille; Manifestation culturelle; Musique instrumentale; Savoir-faire liés à l’artisanat traditionnel; Traction animale; Vache; Zootechnie
element_1112,L’art traditionnel du tissage de shital pati de Sylhet,2017,RL,https://ich.unesco.org/fr/RL/lart-traditionnel-du-tissage-de-shital-pati-de-sylhet-01112,Bangladesh,Tapis; Tissage,Agro-écosystèmes; Artisan; Artisanat; Arts textiles; Autonomisation; Canne; Compétences techniques; Connaissances et pratiques concernant la nature et l’univers; Famille; Ressources végétales; Savoir-faire liés à l’artisanat traditionnel; Teintures naturelles; Traditions et expressions orales
element_1155,Le système traditionnel des juges de l’eau de Corongo,2017,RL,https://ich.unesco.org/fr/RL/le-systme-traditionnel-des-juges-de-leau-de-corongo-01155,Pérou,Droit coutumier; Gestion des ressources en eau; Montagne,"Agriculture; Agro-écosystèmes; Avocat; Canals; Christianisme; Connaissances et pratiques concernant la nature et l’univers; Danse; Eau; Festival; Gestion des ressources; Pratiques sociales, rituels et événements festifs; Rituel de prospérité; Stockage d'eau; Traditions et expressions orales"
element_1156,"Le bateau Oselvar, adaptation du processus d’enseignement traditionnel de sa construction et son utilisation dans un contexte moderne",2016,GSP,https://ich.unesco.org/fr/BSP/le-bateau-oselvar-adaptation-du-processus-denseignement-traditionnel-de-sa-construction-et-son-utilisation-dans-un-contexte-moderne-01156,Norvège,Compétences techniques; Construction navale; Savoir-faire liés à l’artisanat traditionnel; Transfert de savoir-faire,"Apprentissage (métiers); Arbre; Artisanat; Atelier de réparation; Bois; Compétition sportive; Expert; Famille; Guilde; Navigation; Navigation à voile; Organisation culturelle; Pratiques sociales, rituels et événements festifs; Pêche en mer; Restauration; Séminaire (méthode pédagogique); Traditions et expressions orales; Travail du bois; Zones marines, côtières et insulaires"
element_1159,La fête de Khidr Elias et l'expression des vœux,2016,RL,https://ich.unesco.org/fr/RL/la-fte-de-khidr-elias-et-l-expression-des-voeux-01159,Iraq,"Festival; Pratique religieuse; Pratiques sociales, rituels et événements festifs; Rituel de prospérité; Zone urbaine",Agro-écosystèmes; Arts du spectacle; Compétition sportive; Connaissances et pratiques concernant la nature et l’univers; Costumes; Cours d'eau; Danse; Habitude alimentaire; Islam; Musique instrumentale; Offrande; Saint; Savoir-faire liés à l’artisanat traditionnel; Site sacré; Société pluri-ethnique; Traditions et expressions orales; Zone aride
element_1161,"Nawrouz, Novruz, Nowrouz, Nowrouz, Nawrouz, Nauryz, Nooruz, Nowruz, Navruz, Nevruz, Nowruz, Navruz",2016,RL,https://ich.unesco.org/fr/RL/nawrouz-novruz-nowrouz-nowrouz-nawrouz-nauryz-nooruz-nowruz-navruz-nevruz-nowruz-navruz-01161,"Afghanistan, Azerbaïdjan, Inde, Iran (République islamique d’), Iraq, Kazakhstan, Kirghizistan, Ouzbékistan, Pakistan, Tadjikistan, Turkménistan, Türkiye","Festival; Nouvel an; Pratiques sociales, rituels et événements festifs; Rituel de prospérité",Activité sportive; Artisanat; Arts du spectacle; Connaissances et pratiques concernant la nature et l’univers; Costumes; Danse; Habitude alimentaire; Marionnette; Musique instrumentale; Musique vocale; Poésie; Pratique religieuse; Printemps; Savoir-faire liés à l’artisanat traditionnel; Traditions et expressions orales; Écosystème non-spécifique
element_1162,La musique et la danse du merengue en République dominicaine,2016,RL,https://ich.unesco.org/fr/RL/la-musique-et-la-danse-du-merengue-en-rpublique-dominicaine-01162,République dominicaine,Arts du spectacle; Danse; Musique instrumentale; Zone urbaine,"Affectivité; Agriculteur; Agro-écosystèmes; Espace urbain; Fabrication d'instruments; Ile; Musicologie; Musique vocale; Orchestre; Pauvre; Rassemblement; Vie quotidienne; Zones marines, côtières et insulaires"
element_1163,Le yoga,2016,RL,https://ich.unesco.org/fr/RL/le-yoga-01163,Inde,Connaissance spirituelle; Connaissances et pratiques concernant la nature et l’univers; Esprit; Éducation physique,"Activité sportive; Apprentissage (métiers); Arts du spectacle; Habitude alimentaire; Hygiène; Médecine traditionnelle; Philosophie; Pratique religieuse; Pratiques sociales, rituels et événements festifs; Santé; Système respiratoire; Tradition orale; Traditions et expressions orales; Écosystème non-spécifique"
element_1164,"Le Gada, système socio-politique démocratique autochtone des Oromo",2016,RL,https://ich.unesco.org/fr/RL/le-gada-systme-socio-politique-dmocratique-autochtone-des-oromo-01164,Éthiopie,"Démocratie; Gouvernance; Herbage, savanne; Pratiques sociales, rituels et événements festifs",Arbre; Arts du spectacle; Classe dirigeante; Connaissances et pratiques concernant la nature et l’univers; Droits de la femme; Mariage; Montagne; Musique vocale; Pastoralisme; Prise de décision; Rite d'initiation; Règlement de conflit; Système social; Tradition orale; Traditions et expressions orales; Zone aride
element_1165,Le chapei Dang Veng,2016,USL,https://ich.unesco.org/fr/USL/le-chapei-dang-veng-01165,Cambodge,Arts du spectacle; Instruments à cordes pincées; Musique instrumentale; Musique vocale; Écosystème non-spécifique,"Agro-écosystèmes; Apprentissage (métiers); Croyance religieuse; Festival; Improvisation; Inclusion sociale; Mariage; Mémorisation; Narration d'histoires; Orchestre; Peu de praticiens; Politiques répressives; Post-conflit; Poésie; Praticiens âgés; Pratiques de sauvegarde; Pratiques sociales, rituels et événements festifs; Rémunération insuffisante; Satire; Talent; Tradition orale; Traditions et expressions orales; Transmission réduite; Valeur sociale; Zone urbaine"
element_1166,La tradition et la culture du palov,2016,RL,https://ich.unesco.org/fr/RL/la-tradition-et-la-culture-du-palov-01166,Ouzbékistan,"Légume; Pratiques sociales, rituels et événements festifs; Préparation des aliments; Riz; Écosystème non-spécifique","Apprentissage (métiers); Art de la céramique; Arts du spectacle; Connaissances et pratiques concernant la nature et l’univers; Famille; Herbage, savanne; Hospitalité; Mariage; Musique instrumentale; Nouvel an; Savoir-faire liés à l’artisanat traditionnel; Thé; Viande; Zone urbaine"
element_1167,L’artisanat traditionnel du tapis mural en Roumanie et en République de Moldova,2016,RL,https://ich.unesco.org/fr/RL/lartisanat-traditionnel-du-tapis-mural-en-roumanie-et-en-rpublique-de-moldova-01167,"Roumanie, République de Moldova",Savoir-faire liés à l’artisanat traditionnel; Tapis; Tissage,Agro-écosystèmes; Animal; Arts décoratifs; Famille; Femme travailleur; Filage; Fleur; Funérailles; Laine; Mariage; Meuble; Motif; Plante; Teintures naturelles
element_1169,"Les centres régionaux de l'artisanat, stratégie pour sauvegarder le patrimoine culturel de l’artisanat traditionnel",2016,GSP,https://ich.unesco.org/fr/BSP/les-centres-rgionaux-de-l-artisanat-stratgie-pour-sauvegarder-le-patrimoine-culturel-de-lartisanat-traditionnel-01169,Autriche,Artisanat; Savoir-faire liés à l’artisanat traditionnel; Établissement d'enseignement,Apprentissage (métiers); Arts textiles; Centre de formation; Chapeaux; Commercialisation; Compétences techniques; Connaissances et pratiques concernant la nature et l’univers; Coopérative; Exposition; Meuble; Organisation culturelle; Organisation régionale; Partenariat public privé; Peinture; Pratiques de sauvegarde; Prix et distinction; Tissage; Travail du bois
element_1170,Gnaoua,2019,RL,https://ich.unesco.org/fr/RL/gnaoua-01170,Maroc,Esclavage; Musique vocale; Médecine traditionnelle; Zone urbaine,"Agro-écosystèmes; Confrérie; Costumes; Danse; Désert; Fabrication d'instruments; Festival; Idiophones; Instruments de percussion; Instruments à cordes; Préparation des aliments; Transe; Zones marines, côtières et insulaires"
element_1172,Le procédé traditionnel de préparation de l’aïrag dans un khokhuur et les coutumes associées,2019,RL,https://ich.unesco.org/fr/RL/le-procd-traditionnel-de-prparation-de-larag-dans-un-khokhuur-et-les-coutumes-associes-01172,Mongolie,"Boissons fermentées; Cheval; Herbage, savanne; Lait",Artisanat; Cuir; Diététique; Montagne; Nomade; Offrande; Pastoralisme; Préparation des aliments; Travail du bois; Vache; Zootechnie
element_1177,"Le concept Kodály, sauvegarde du patrimoine musical traditionnel",2016,GSP,https://ich.unesco.org/fr/BSP/le-concept-kodly-sauvegarde-du-patrimoine-musical-traditionnel-01177,Hongrie,Musique vocale; Éducation musicale,Affectivité; Art populaire; Arts du spectacle; Chant polyphonique; Choeur; Créativité; Enregistrement sonore; Expression écrite; Grossesse; Inclusion sociale; Musicologie; Méthode pédagogique; Organisation culturelle; Pratiques de sauvegarde; Stratégie de la recherche; Traditions et expressions orales; École maternelle; Éducation de la prime enfance
element_1178,"Le geetgawai, chants populaires en bhojpuri à Maurice",2016,RL,https://ich.unesco.org/fr/RL/le-geetgawai-chants-populaires-en-bhojpuri-maurice-01178,Maurice,"Danse; Mariage; Musique instrumentale; Musique vocale; Pratiques sociales, rituels et événements festifs","Arts du spectacle; Caste; Connaissances et pratiques concernant la nature et l’univers; Costumes; Famille; Hindouisme; Inclusion sociale; Instrument de musique; Percussions corporelles; Rituels; Riz; Traditions et expressions orales; Zones marines, côtières et insulaires"
element_1181,"La culture de la fabrication et du partage de pain plat Lavash, Katyrma, Jupka, Yufka",2016,RL,https://ich.unesco.org/fr/RL/la-culture-de-la-fabrication-et-du-partage-de-pain-plat-lavash-katyrma-jupka-yufka-01181,"Azerbaïdjan, Iran (République islamique d’), Kazakhstan, Kirghizistan, Türkiye",Pain; Préparation des aliments; Écosystème non-spécifique,"Agriculture; Agro-écosystèmes; Connaissances et pratiques concernant la nature et l’univers; Céréale; Famille; Funérailles; Habitude alimentaire; Hospitalité; Mariage; Naissance; Nomade; Pratiques sociales, rituels et événements festifs; Rituel de prospérité; Traditions et expressions orales; Vénération des morts; Zone urbaine"
element_1182,Les parcours rituels dans la ville de La Paz pendant l'Alasita,2017,RL,https://ich.unesco.org/fr/RL/les-parcours-rituels-dans-la-ville-de-la-paz-pendant-l-alasita-01182,Bolivie (État plurinational de),Festival; Pratique religieuse; Rituel de prospérité; Zone urbaine,"Artisanat; Christianisme; Encens; Famille; Inclusion sociale; Jouet; Montagne; Objets rituels; Offrande; Pratiques sociales, rituels et événements festifs; Savoir-faire liés à l’artisanat traditionnel; Syncrétisme religieux"
element_1184,"La Momoeria, fêtes du Nouvel An dans huit villages de la région de Kozani, en Macédoine occidentale (Grèce)",2016,RL,https://ich.unesco.org/fr/RL/la-momoeria-ftes-du-nouvel-an-dans-huit-villages-de-la-rgion-de-kozani-en-macdoine-occidentale-grce-01184,Grèce,Arts du spectacle; Danse; Nouvel an; Rituel de prospérité; Zone urbaine,"Agro-écosystèmes; Chorégraphie; Costumes; Drame; Masque; Montagne; Musique instrumentale; Participation du public; Pratiques sociales, rituels et événements festifs; Procession; Rituel de purification; Satire; Savoir-faire liés à l’artisanat traditionnel; Traditions et expressions orales; Travestissement"
element_1185,"La rumba à Cuba, mélange festif de musiques et de danses et toutes les pratiques associées",2016,RL,https://ich.unesco.org/fr/RL/la-rumba-cuba-mlange-festif-de-musiques-et-de-danses-et-toutes-les-pratiques-associes-01185,Cuba,"Danse; Musique instrumentale; Musique vocale; Pratiques sociales, rituels et événements festifs; Zone urbaine","Affectivité; Agro-écosystèmes; Arts du spectacle; Classe ouvrière; Connaissances et pratiques concernant la nature et l’univers; Esclavage; Famille; Festival; Idiophones; Ile; Instruments de percussion; Musicologie; Participation du public; Percussions corporelles; Pratique religieuse; Savoir-faire liés à l’artisanat traditionnel; Traditions et expressions orales; Zones marines, côtières et insulaires"
element_1187,La danse et musique de lyre arquée ma’di ,2016,USL,https://ich.unesco.org/fr/USL/la-danse-et-musique-de-lyre-arque-madi-01187,Ouganda,"Danse; Herbage, savanne; Instruments à cordes pincées; Musique instrumentale; Musique vocale; Pratiques sociales, rituels et événements festifs",Affectivité; Agro-écosystèmes; Arbre; Arts du spectacle; Changements socioculturels abruptes; Clan; Compétences techniques; Conflits; Espèce en danger; Exode rural; Fabrication d'instruments; Famille; Forêt; Funérailles; Histoire orale; Manque de respect; Mariage; Nouveaux passe-temps; Perte de signification; Pratique réduite; Produit d'origine animale; Préparation des aliments; Pénurie de matériaux; Rituel agraire; Rituels; Règlement de conflit; Savoir-faire liés à l’artisanat traditionnel; Transmission interromptue; Vénération des morts; Écosystème dégradé
element_1188,"La tradition de la préparation et du partage du dolma, marqueur d'identité culturelle",2017,RL,https://ich.unesco.org/fr/RL/la-tradition-de-la-prparation-et-du-partage-du-dolma-marqueur-d-identit-culturelle-01188,Azerbaïdjan,Préparation des aliments; Riz; Viande; Écosystème non-spécifique,"Agro-écosystèmes; Compétences techniques; Connaissances et pratiques concernant la nature et l’univers; Division du travail basée sur le sexe; Habitude alimentaire; Hospitalité; Légume; Montagne; Pratiques sociales, rituels et événements festifs; Rassemblement; Ressources végétales; Zone urbaine"
element_1189,"Le tahteeb, jeu du bâton",2016,RL,https://ich.unesco.org/fr/RL/le-tahteeb-jeu-du-bton-01189,Égypte,"Compétition sportive; Jeux; Pratiques sociales, rituels et événements festifs; Zone aride",Agro-écosystèmes; Amitié; Apprentissage (métiers); Arts du spectacle; Arts du spectacle; Arts martiaux; Bois (instruments); Bâton; Canne; Chorégraphie; Famille; Instruments de percussion; Musique instrumentale; Valeur morale; Zone urbaine
element_1190,"Le yalli (kochari, tenzere), danses collectives traditionnelles du Nakhtchivan",2018,USL,https://ich.unesco.org/fr/USL/le-yalli-kochari-tenzere-danses-collectives-traditionnelles-du-nakhtchivan-01190,Azerbaïdjan,Agro-écosystèmes; Danse; Musique instrumentale; Musique vocale,"Animal; Arts du spectacle; Bois (instruments); Chorégraphie; Conflits; Costumes; Exode rural; Festival; Instruments de percussion; Jeux; Montagne; Oiseau; Pantomime; Pastoralisme; Perte de signification; Peu de praticiens; Pratique réduite; Pratiques sociales, rituels et événements festifs; Répertoire restreint; Talent; Théâtralisation; Traditions et expressions orales; Zone aride"
element_1191,"L'Oshi Palav, plat traditionnel et ses contextes sociaux et culturels au Tadjikistan",2016,RL,https://ich.unesco.org/fr/RL/l-oshi-palav-plat-traditionnel-et-ses-contextes-sociaux-et-culturels-au-tadjikistan-01191,Tadjikistan,"Pratiques sociales, rituels et événements festifs; Préparation des aliments; Riz; Écosystème non-spécifique","Amitié; Apprentissage (métiers); Arts du spectacle; Herbage, savanne; Hospitalité; Littérature folklorique; Légume; Montagne; Musique instrumentale; Pratiques socioculturelles; Rituels; Règlement de conflit; Savoir-faire liés à l’artisanat traditionnel; Traditions et expressions orales; Viande"
element_1194,Les chants cosaques de la région de Dnipropetrovsk,2016,USL,https://ich.unesco.org/fr/USL/les-chants-cosaques-de-la-rgion-de-dnipropetrovsk-01194,Ukraine,"Arts du spectacle; Chant polyphonique; Herbage, savanne; Musique vocale",Agro-écosystèmes; Diminution de l'intérêt de la jeunesse; Diminution de la participation; Famille; Forces armées; Formation laborieuse; Guerre; Habitude alimentaire; Histoire orale; Médias de communication de masse; Perte de signification; Praticiens âgés; Répertoire restreint; Talent; Transmission interromptue; Éducation non formelle
element_1196,"Alardah Alnajdiyah, danse, tambours et poésie d’Arabie saoudite",2015,RL,https://ich.unesco.org/fr/RL/alardah-alnajdiyah-danse-tambours-et-posie-darabie-saoudite-01196,Arabie saoudite,Danse; Instruments de percussion; Musique vocale; Zone aride,"Armes blanches; Arts du spectacle; Choeur; Chorégraphie; Costumes; Généalogie; Mariage; Musique instrumentale; Poésie; Pratique religieuse; Pratiques sociales, rituels et événements festifs; Rassemblement; Savoir-faire liés à l’artisanat traditionnel; Traditions et expressions orales; Zone urbaine"
element_1197,"Le pinisi, art de la construction navale en Sulawesi du sud",2017,RL,https://ich.unesco.org/fr/RL/le-pinisi-art-de-la-construction-navale-en-sulawesi-du-sud-01197,Indonésie,Compétences techniques; Construction navale; Savoir-faire liés à l’artisanat traditionnel,"Apprentissage (métiers); Arbre; Artisanat; Bois; Charpenterie; Navigation; Navigation à voile; Pratiques sociales, rituels et événements festifs; Pêche en mer; Ressources économiques; Traditions et expressions orales; Travail du bois; Zones marines, côtières et insulaires; Éducation non formelle"
element_1198,"Le carnaval d’El Callao, représentation festive d’une mémoire et d’une identité culturelle",2016,RL,https://ich.unesco.org/fr/RL/le-carnaval-del-callao-reprsentation-festive-dune-mmoire-et-dune-identit-culturelle-01198,Venezuela (République bolivarienne du),"Carnaval; Festival; Pratiques sociales, rituels et événements festifs",Artisanat; Arts du spectacle; Costumes; Danse; Esclavage; Famille; Histoire coloniale; Industrie minière; Masque; Musique instrumentale; Procession; Zone urbaine
element_1199,Le processus de fabrication de la poterie noire de Bisalhães,2016,USL,https://ich.unesco.org/fr/USL/le-processus-de-fabrication-de-la-poterie-noire-de-bisalhes-01199,Portugal,Agro-écosystèmes; Compétences techniques; Poterie; Savoir-faire liés à l’artisanat traditionnel,Argile; Artisan; Arts décoratifs; Diminution de l'intérêt de la jeunesse; Division du travail basée sur le sexe; Eau; Feu; Four à céramique; Matière première; Montagne; Motif; Outils traditionnels; Parenté; Perte de signification; Praticiens âgés; Pratique réduite; Production industrielle; Pétrification; Rémunération insuffisante; Transmission interromptue
element_1200,L’idée et la pratique d’intérêts communs organisés en coopératives,2016,RL,https://ich.unesco.org/fr/RL/lide-et-la-pratique-dintrts-communs-organiss-en-coopratives-01200,Allemagne,"Action communautaire; Coopérative; Pratiques sociales, rituels et événements festifs",Aide au développement; Bénévole; Création d'emploi; Démocratie; Développement participatif; Participation sociale; Société civile; Travailleur; Valeur morale; Écosystème non-spécifique
element_1201,La Fête des vignerons de Vevey,2016,RL,https://ich.unesco.org/fr/RL/la-fte-des-vignerons-de-vevey-01201,Suisse,"Arts du spectacle; Festival; Pratiques sociales, rituels et événements festifs; Vinification; Zone urbaine",Agriculteur; Amitié; Artisan; Arts du spectacle; Boisson alcoolisée; Bénévole; Concours; Costumes; Famille; Lac; Montagne; Musique instrumentale; Musique vocale; Procession; Terres humides intérieures
element_1202,Le théâtre de marionnettes en Slovaquie et en Tchéquie,2016,RL,https://ich.unesco.org/fr/RL/le-thtre-de-marionnettes-en-slovaquie-et-en-tchquie-01202,"Slovaquie, Tchéquie",Arts du spectacle; Marionnette; Théâtre; Écosystème non-spécifique,"Agro-écosystèmes; Artisan; Artisanat; Bois; Costumes; Famille; Festival; Humour (littéraire); Littérature folklorique; Musique vocale; Pratiques sociales, rituels et événements festifs; Restauration; Savoir-faire liés à l’artisanat traditionnel; Sculpture sur bois; Traditions et expressions orales; Valeur morale; Zone urbaine"
element_1203,La représentation de la Passion à Škofja Loka,2016,RL,https://ich.unesco.org/fr/RL/la-reprsentation-de-la-passion-kofja-loka-01203,Slovénie,Arts du spectacle; Arts du spectacle; Théâtre,"Artisan; Artisanat; Bénévole; Christianisme; Costumes; Famille; Maquillage; Musique vocale; Pratique religieuse; Pratiques sociales, rituels et événements festifs; Procession; Reconstitution historique; Savoir-faire liés à l’artisanat traditionnel; Traditions et expressions orales; Zone urbaine"
element_1205,La culture vivante des trois systèmes d'écriture de l'alphabet géorgien,2016,RL,https://ich.unesco.org/fr/RL/la-culture-vivante-des-trois-systmes-d-criture-de-l-alphabet-gorgien-01205,Géorgie,Alphabet; Calligraphie; Traditions et expressions orales,"Art religieux; Artisan; Artisanat; Arts du spectacle; Broderie; Eglise orthodoxe orientale; Manuscrit; Peintre; Pratiques sociales, rituels et événements festifs; Savoir-faire liés à l’artisanat traditionnel; Sculpteur; Écosystème non-spécifique; Écriture manuscrite; Édition électronique; Éducation religieuse"
element_1207,"Les savoir-faire liés au parfum en Pays de Grasse : la culture de la plante à parfum, la connaissance des matières premières naturelles et leur transformation, l'art de composer le parfum",2018,RL,https://ich.unesco.org/fr/RL/les-savoir-faire-lis-au-parfum-en-pays-de-grasse-la-culture-de-la-plante-parfum-la-connaissance-des-matires-premires-naturelles-et-leur-transformation-l-art-de-composer-le-parfum-01207,France,Agro-écosystèmes; Compétences techniques; Huile végétale; Industrie du luxe; Ressources végétales,"Arbre; Artisan; Arts du spectacle; Connaissances et pratiques concernant la nature et l’univers; Créativité; Fleur; Horticulture; Matière première; Montagne; Météorologie; Pratiques sociales, rituels et événements festifs; Saisons; Savoir-faire liés à l’artisanat traditionnel; Système sensoriel; Talent; Technologie chimique; Traditions et expressions orales; Zones marines, côtières et insulaires; Éducation non formelle"
